,,,,
"Watch this video (http://openstaxcollege.org/l/emotions) to learn about physical responses to emotion. The
autonomic system, which is important for regulating the homeostasis of the organ systems, is also responsible for
our physiological responses to emotions such as fear. The video summarizes the extent of the body’s reactions
and describes several effects of the autonomic system in response to fear. On the basis of what you have already
studiedaboutautonomicfunction,whicheffectwouldyouexpecttobeassociatedwithparasympathetic,ratherthan
sympathetic, activity?",,,,
